2019,12,"OO","SkyWest Airlines Inc.","AVP","Scranton/Wilkes-Barre, PA: Wilkes Barre Scranton International",80.00,19.00,7.94,2.78,6.79,0.00,1.49,2.00,0.00,1412.00,500.00,547.00,312.00,0.00,53.00,
2019,12,"OO","SkyWest Airlines Inc.","AZO","Kalamazoo, MI: Kalamazoo/Battle Creek International",157.00,32.00,14.26,3.43,4.06,0.00,10.26,3.00,0.00,2411.00,977.00,561.00,282.00,0.00,591.00,
2019,12,"OO","SkyWest Airlines Inc.","BDL","Hartford, CT: Bradley International",63.00,10.00,3.44,1.00,3.56,0.00,2.00,1.00,0.00,589.00,231.00,107.00,89.00,0.00,162.00,
2019,12,"OO","SkyWest Airlines Inc.","BFF","Scottsbluff, NE: Western Neb. Regional/William B. Heilig Field",53.00,8.00,3.70,0.00,0.50,0.00,3.80,2.00,0.00,976.00,791.00,0.00,11.00,0.00,174.00,
2019,12,"OO","SkyWest Airlines Inc.","BFL","Bakersfield, CA: Meadows Field",126.00,23.00,8.06,0.00,6.13,0.00,8.81,1.00,2.00,1445.00,649.00,0.00,171.00,0.00,625.00,
2019,12,"OO","SkyWest Airlines Inc.","BGM","Binghamton, NY: Greater Binghamton/Edwin A. Link Field",86.00,10.00,1.00,1.78,0.31,0.00,6.91,6.00,2.00,640.00,24.00,214.00,23.00,0.00,379.00,
2019,12,"OO","SkyWest Airlines Inc.","BGR","Bangor, ME: Bangor International",2.00,1.00,0.80,0.00,0.00,0.00,0.20,0.00,0.00,35.00,28.00,0.00,0.00,0.00,7.00,
2019,12,"OO","SkyWest Airlines Inc.","BHM","Birmingham, AL: Birmingham-Shuttlesworth International",156.00,39.00,20.02,1.00,6.03,0.00,11.95,1.00,0.00,3564.00,1988.00,79.00,235.00,0.00,1262.00,
2019,12,"OO","SkyWest Airlines Inc.","BIL","Billings, MT: Billings Logan International",154.00,29.00,15.85,2.30,6.42,0.00,4.42,1.00,2.00,1672.00,1027.00,120.00,241.00,0.00,284.00,
2019,12,"OO","SkyWest Airlines Inc.","BIS","Bismarck/Mandan, ND: Bismarck Municipal",234.00,45.00,10.75,4.52,14.45,0.00,15.28,2.00,1.00,3900.00,768.00,1659.00,418.00,0.00,1055.00,
2019,12,"OO","SkyWest Airlines Inc.","BJI","Bemidji, MN: Bemidji Regional",62.00,10.00,1.00,3.00,4.14,0.00,1.86,2.00,0.00,911.00,61.00,374.00,151.00,0.00,325.00,
2019,12,"OO","SkyWest Airlines Inc.","BNA","Nashville, TN: Nashville International",472.00,100.00,24.00,3.01,27.96,0.00,45.02,6.00,0.00,8906.00,3027.00,561.00,1452.00,0.00,3866.00,
2019,12,"OO","SkyWest Airlines Inc.","BOI","Boise, ID: Boise Air Terminal",951.00,171.00,59.25,5.73,22.58,0.00,83.44,12.00,2.00,14357.00,6434.00,453.00,760.00,0.00,6710.00,
2019,12,"OO","SkyWest Airlines Inc.","BOS","Boston, MA: Logan International",61.00,20.00,2.86,0.11,11.71,0.52,4.79,6.00,0.00,1625.00,232.00,26.00,978.00,11.00,378.00,
2019,12,"OO","SkyWest Airlines Inc.","BQK","Brunswick, GA: Brunswick Golden Isles",89.00,10.00,6.60,0.41,1.74,0.00,1.25,0.00,0.00,1425.00,1251.00,17.00,102.00,0.00,55.00,
2019,12,"OO","SkyWest Airlines Inc.","BRD","Brainerd, MN: Brainerd Lakes Regional",54.00,9.00,1.00,3.00,0.34,0.00,4.66,0.00,0.00,1602.00,20.00,1190.00,32.00,0.00,360.00,
2019,12,"OO","SkyWest Airlines Inc.","BRO","Brownsville, TX: Brownsville South Padre Island International",3.00,0.00,0.00,0.00,0.00,0.00,0.00,0.00,0.00,0.00,0.00,0.00,0.00,0.00,0.00,
2019,12,"OO","SkyWest Airlines Inc.","BTM","Butte, MT: Bert Mooney",58.00,5.00,3.80,0.00,1.00,0.00,0.20,0.00,0.00,382.00,309.00,0.00,31.00,0.00,42.00,
2019,12,"OO","SkyWest Airlines Inc.","BTR","Baton Rouge, LA: Baton Rouge Metropolitan/Ryan Field",44.00,7.00,2.23,0.00,0.00,0.00,4.77,0.00,0.00,566.00,164.00,0.00,0.00,0.00,402.00,
2019,12,"OO","SkyWest Airlines Inc.","BTV","Burlington, VT: Burlington International",16.00,4.00,2.00,0.00,2.00,0.00,0.00,1.00,0.00,129.00,32.00,0.00,97.00,0.00,0.00,
2019,12,"OO","SkyWest Airlines Inc.","BUF","Buffalo, NY: Buffalo Niagara International",96.00,26.00,8.82,4.21,4.20,0.00,8.77,2.00,0.00,2672.00,1392.00,400.00,114.00,0.00,766.00,
2019,12,"OO","SkyWest Airlines Inc.","BUR","Burbank, CA: Bob Hope",374.00,80.00,20.89,3.03,18.41,0.00,37.66,18.00,2.00,5609.00,1854.00,191.00,599.00,0.00,2965.00,
2019,12,"OO","SkyWest Airlines Inc.","BWI","Baltimore, MD: Baltimore/Washington International Thurgood Marshall",46.00,7.00,1.20,1.24,1.46,0.00,3.10,0.00,0.00,544.00,22.00,215.00,106.00,0.00,201.00,
2019,12,"OO","SkyWest Airlines Inc.","BZN","Bozeman, MT: Bozeman Yellowstone International",214.00,32.00,8.74,1.00,4.78,0.00,17.48,8.00,1.00,1936.00,541.00,29.00,182.00,0.00,1184.00,
2019,12,"OO","SkyWest Airlines Inc.","CAE","Columbia, SC: Columbia Metropolitan",2.00,0.00,0.00,0.00,0.00,0.00,0.00,0.00,0.00,0.00,0.00,0.00,0.00,0.00,0.00,
2019,12,"OO","SkyWest Airlines Inc.","CAK","Akron, OH: Akron-Canton Regional",68.00,16.00,3.66,0.00,6.14,0.00,6.20,3.00,0.00,1412.00,796.00,0.00,327.00,0.00,289.00,
2019,12,"OO","SkyWest Airlines Inc.","CDC","Cedar City, UT: Cedar City Regional",53.00,3.00,2.00,0.56,0.00,0.00,0.44,0.00,0.00,328.00,195.00,75.00,0.00,0.00,58.00,
2019,12,"OO","SkyWest Airlines Inc.","CGI","Cape Girardeau, MO: Cape Girardeau Regional",55.00,9.00,4.08,0.00,1.79,0.00,3.13,0.00,1.00,1294.00,1000.00,0.00,120.00,0.00,174.00,
2019,12,"OO","SkyWest Airlines Inc.","CHA","Chattanooga, TN: Lovell Field",203.00,36.00,14.44,2.46,3.38,0.00,15.72,0.00,0.00,2989.00,2109.00,70.00,85.00,0.00,725.00,
2019,12,"OO","SkyWest Airlines Inc.","CHO","Charlottesville, VA: Charlottesville Albemarle",97.00,21.00,6.72,1.62,4.72,0.00,7.94,4.00,0.00,1642.00,1077.00,48.00,159.00,0.00,358.00,
2019,12,"OO","SkyWest Airlines Inc.","CHS","Charleston, SC: Charleston AFB/International",136.00,27.00,10.35,2.00,7.37,0.00,7.28,3.00,1.00,2025.00,1117.00,108.00,325.00,0.00,475.00,
2019,12,"OO","SkyWest Airlines Inc.","CID","Cedar Rapids/Iowa City, IA: The Eastern Iowa",175.00,29.00,11.31,3.92,6.51,0.00,7.25,2.00,0.00,1933.00,576.00,293.00,366.00,0.00,698.00,
2019,12,"OO","SkyWest Airlines Inc.","CIU","Sault Ste. Marie, MI: Chippewa County International",56.00,11.00,3.39,2.91,2.42,0.00,2.28,4.00,1.00,714.00,199.00,350.00,77.00,0.00,88.00,
2019,12,"OO","SkyWest Airlines Inc.","CKB","Clarksburg/Fairmont, WV: North Central West Virginia",61.00,14.00,6.18,1.67,1.20,0.00,4.95,1.00,1.00,2078.00,1103.00,121.00,668.00,0.00,186.00,
2019,12,"OO","SkyWest Airlines Inc.","CLE","Cleveland, OH: Cleveland-Hopkins International",122.00,27.00,6.28,0.15,9.45,1.00,10.13,0.00,0.00,2422.00,1014.00,3.00,398.00,24.00,983.00,
2019,12,"OO","SkyWest Airlines Inc.","CLL","College Station/Bryan, TX: Easterwood Field",26.00,2.00,1.00,0.00,0.00,0.00,1.00,0.00,0.00,247.00,30.00,0.00,0.00,0.00,217.00,
2019,12,"OO","SkyWest Airlines Inc.","CLT","Charlotte, NC: Charlotte Douglas International",89.00,21.00,10.25,2.13,3.70,0.00,4.92,1.00,0.00,1600.00,970.00,103.00,137.00,0.00,390.00,
2019,12,"OO","SkyWest Airlines Inc.","CMH","Columbus, OH: John Glenn Columbus International",175.00,33.00,14.35,1.34,7.78,0.00,9.52,2.00,3.00,2342.00,765.00,759.00,274.00,0.00,544.00,
2019,12,"OO","SkyWest Airlines Inc.","CMX","Hancock/Houghton, MI: Houghton County Memorial",61.00,11.00,3.48,0.00,1.48,0.00,6.05,8.00,0.00,672.00,250.00,0.00,94.00,0.00,328.00,
2019,12,"OO","SkyWest Airlines Inc.","CNY","Moab, UT: Canyonlands Field",31.00,11.00,4.00,0.00,2.58,0.00,4.42,1.00,0.00,1176.00,488.00,0.00,124.00,0.00,564.00,
2019,12,"OO","SkyWest Airlines Inc.","COD","Cody, WY: Yellowstone Regional",2.00,1.00,1.00,0.00,0.00,0.00,0.00,0.00,0.00,19.00,19.00,0.00,0.00,0.00,0.00,
2019,12,"OO","SkyWest Airlines Inc.","COS","Colorado Springs, CO: City of Colorado Springs Municipal",525.00,135.00,57.57,4.50,25.62,0.00,47.31,5.00,2.00,9741.00,4607.00,1003.00,772.00,0.00,3359.00,
2019,12,"OO","SkyWest Airlines Inc.","COU","Columbia, MO: Columbia Regional",139.00,28.00,7.33,0.97,5.69,0.00,14.00,2.00,0.00,1795.00,339.00,77.00,218.00,0.00,1161.00,
2019,12,"OO","SkyWest Airlines Inc.","CPR","Casper, WY: Casper/Natrona County International",94.00,10.00,3.21,1.89,1.79,0.00,3.11,0.00,0.00,1329.00,250.00,785.00,39.00,0.00,255.00,
2019,12,"OO","SkyWest Airlines Inc.","CRP","Corpus Christi, TX: Corpus Christi International",54.00,9.00,3.28,0.00,2.31,0.00,3.41,3.00,0.00,737.00,368.00,0.00,78.00,0.00,291.00,
2019,12,"OO","SkyWest Airlines Inc.","CRW","Charleston/Dunbar, WV: Yeager",147.00,35.00,10.90,4.78,8.57,0.00,10.75,1.00,2.00,2919.00,1473.00,333.00,271.00,0.00,842.00,
2019,12,"OO","SkyWest Airlines Inc.","CVG","Cincinnati, OH: Cincinnati/Northern Kentucky International",11.00,1.00,0.36,0.00,0.64,0.00,0.00,1.00,0.00,25.00,9.00,0.00,16.00,0.00,0.00,
2019,12,"OO","SkyWest Airlines Inc.","CWA","Mosinee, WI: Central Wisconsin",2.00,0.00,0.00,0.00,0.00,0.00,0.00,1.00,0.00,0.00,0.00,0.00,0.00,0.00,0.00,
2019,12,"OO","SkyWest Airlines Inc.","CYS","Cheyenne, WY: Cheyenne Regional/Jerry Olson Field",31.00,7.00,3.07,1.00,0.00,0.00,2.93,1.00,0.00,503.00,145.00,94.00,0.00,0.00,264.00,
2019,12,"OO","SkyWest Airlines Inc.","DAL","Dallas, TX: Dallas Love Field",277.00,40.00,9.12,0.00,18.54,0.00,12.34,3.00,0.00,2170.00,650.00,0.00,556.00,0.00,964.00,
2019,12,"OO","SkyWest Airlines Inc.","DAY","Dayton, OH: James M Cox/Dayton International",196.00,34.00,10.61,1.33,8.12,0.00,13.94,1.00,1.00,2671.00,1328.00,74.00,390.00,0.00,879.00,
2019,12,"OO","SkyWest Airlines Inc.","DCA","Washington, DC: Ronald Reagan Washington National",16.00,5.00,2.00,0.00,0.81,0.00,2.19,0.00,0.00,263.00,64.00,0.00,17.00,0.00,182.00,
2019,12,"OO","SkyWest Airlines Inc.","DEN","Denver, CO: Denver International",4557.00,802.00,198.41,27.16,213.11,2.63,360.70,138.00,11.00,84051.00,35539.00,3932.00,10541.00,80.00,33959.00,
2019,12,"OO","SkyWest Airlines Inc.","DFW","Dallas/Fort Worth, TX: Dallas/Fort Worth International",1449.00,302.00,69.25,21.00,68.87,0.00,142.88,27.00,5.00,31391.00,10771.00,3960.00,3475.00,0.00,13185.00,
2019,12,"OO","SkyWest Airlines Inc.","DHN","Dothan, AL: Dothan Regional",117.00,16.00,4.00,1.29,0.25,0.00,10.46,0.00,1.00,812.00,240.00,42.00,6.00,0.00,524.00,
2019,12,"OO","SkyWest Airlines Inc.","DLH","Duluth, MN: Duluth International",213.00,46.00,17.69,8.21,8.32,0.00,11.78,10.00,0.00,5277.00,1922.00,1727.00,409.00,0.00,1219.00,
2019,12,"OO","SkyWest Airlines Inc.","DRO","Durango, CO: Durango La Plata County",18.00,3.00,2.00,0.00,0.00,0.00,1.00,3.00,0.00,115.00,96.00,0.00,0.00,0.00,19.00,
2019,12,"OO","SkyWest Airlines Inc.","DSM","Des Moines, IA: Des Moines International",270.00,49.00,10.73,1.36,13.22,0.00,23.68,1.00,0.00,2730.00,579.00,97.00,501.00,0.00,1553.00,
2019,12,"OO","SkyWest Airlines Inc.","DTW","Detroit, MI: Detroit Metro Wayne County",3814.00,614.00,124.14,45.01,93.87,1.60,349.39,55.00,3.00,64020.00,17654.00,12655.00,3921.00,53.00,29737.00,
2019,12,"OO","SkyWest Airlines Inc.","DVL","Devils Lake, ND: Devils Lake Regional",53.00,7.00,1.15,0.98,0.99,0.00,3.88,3.00,0.00,1355.00,702.00,128.00,49.00,0.00,476.00,
2019,12,"OO","SkyWest Airlines Inc.","EAR","Kearney, NE: Kearney Regional",87.00,19.00,6.83,1.00,1.28,0.00,9.88,3.00,0.00,1807.00,1127.00,45.00,91.00,0.00,544.00,
2019,12,"OO","SkyWest Airlines Inc.","EAU","Eau Claire, WI: Chippewa Valley Regional",61.00,15.00,4.75,0.07,2.86,0.00,7.31,4.00,0.00,773.00,371.00,2.00,78.00,0.00,322.00,
2019,12,"OO","SkyWest Airlines Inc.","EGE","Eagle, CO: Eagle County Regional",119.00,32.00,7.92,5.91,12.61,0.00,5.56,7.00,2.00,4120.00,594.00,2221.00,1018.00,0.00,287.00,
2019,12,"OO","SkyWest Airlines Inc.","EKO","Elko, NV: Elko Regional",58.00,5.00,0.93,0.99,1.08,0.00,2.00,0.00,0.00,1107.00,175.00,752.00,35.00,0.00,145.00,
2019,12,"OO","SkyWest Airlines Inc.","ELM","Elmira/Corning, NY: Elmira/Corning Regional",136.00,21.00,7.42,1.56,2.09,0.00,9.94,2.00,1.00,1225.00,469.00,57.00,89.00,0.00,610.00,
2019,12,"OO","SkyWest Airlines Inc.","ELP","El Paso, TX: El Paso International",63.00,10.00,6.75,0.00,0.39,0.00,2.86,0.00,0.00,579.00,244.00,0.00,32.00,0.00,303.00,
2019,12,"OO","SkyWest Airlines Inc.","ERI","Erie, PA: Erie International/Tom Ridge Field",79.00,20.00,9.23,2.93,1.25,0.00,6.59,0.00,1.00,1395.00,693.00,270.00,48.00,0.00,384.00,
2019,12,"OO","SkyWest Airlines Inc.","ESC","Escanaba, MI: Delta County",53.00,11.00,3.58,2.93,1.17,0.00,3.32,7.00,3.00,2783.00,509.00,1738.00,57.00,0.00,479.00,
2019,12,"OO","SkyWest Airlines Inc.","EUG","Eugene, OR: Mahlon Sweet Field",466.00,79.00,30.48,4.51,19.33,0.90,23.78,16.00,4.00,5087.00,2424.00,399.00,568.00,140.00,1556.00,
2019,12,"OO","SkyWest Airlines Inc.","EVV","Evansville, IN: Evansville Regional",62.00,14.00,4.74,0.26,3.03,0.00,5.97,2.00,0.00,554.00,166.00,5.00,108.00,0.00,275.00,
2019,12,"OO","SkyWest Airlines Inc.","EWR","Newark, NJ: Newark Liberty International",31.00,11.00,4.77,0.00,4.08,0.00,2.15,0.00,0.00,797.00,303.00,0.00,332.00,0.00,162.00,
2019,12,"OO","SkyWest Airlines Inc.","FAR","Fargo, ND: Hector International",180.00,39.00,16.52,3.95,7.16,0.00,11.36,9.00,1.00,4166.00,2252.00,499.00,411.00,0.00,1004.00,
2019,12,"OO","SkyWest Airlines Inc.","FAT","Fresno, CA: Fresno Yosemite International",763.00,135.00,44.37,4.48,16.96,0.00,69.19,15.00,2.00,10658.00,4357.00,492.00,479.00,0.00,5330.00,
2019,12,"OO","SkyWest Airlines Inc.","FAY","Fayetteville, NC: Fayetteville Regional/Grannis Field",103.00,20.00,7.93,1.22,2.85,0.00,8.00,0.00,0.00,1489.00,556.00,161.00,93.00,0.00,679.00,
2019,12,"OO","SkyWest Airlines Inc.","FCA","Kalispell, MT: Glacier Park International",131.00,17.00,6.79,0.26,2.52,0.00,7.44,0.00,0.00,1526.00,862.00,5.00,67.00,0.00,592.00,
2019,12,"OO","SkyWest Airlines Inc.","FLG","Flagstaff, AZ: Flagstaff Pulliam",156.00,20.00,6.55,1.00,3.02,0.00,9.43,7.00,2.00,1425.00,635.00,144.00,101.00,0.00,545.00,
2019,12,"OO","SkyWest Airlines Inc.","FNT","Flint, MI: Bishop International",34.00,10.00,3.99,0.00,1.60,0.00,4.41,0.00,0.00,660.00,194.00,0.00,124.00,0.00,342.00,
2019,12,"OO","SkyWest Airlines Inc.","FSD","Sioux Falls, SD: Joe Foss Field",243.00,53.00,18.08,2.74,14.43,0.00,17.75,1.00,2.00,3749.00,1684.00,157.00,621.00,0.00,1287.00,
2019,12,"OO","SkyWest Airlines Inc.","FSM","Fort Smith, AR: Fort Smith Regional",71.00,9.00,1.03,1.00,0.91,0.00,6.07,0.00,1.00,742.00,38.00,26.00,43.00,0.00,635.00,
2019,12,"OO","SkyWest Airlines Inc.","FWA","Fort Wayne, IN: Fort Wayne International",394.00,81.00,28.44,6.25,14.55,0.00,31.76,6.00,3.00,8969.00,3627.00,2037.00,709.00,0.00,2596.00,
2019,12,"OO","SkyWest Airlines Inc.","GCC","Gillette, WY: Gillette Campbell County",81.00,13.00,7.75,0.00,0.48,0.00,4.77,2.00,0.00,1088.00,788.00,0.00,29.00,0.00,271.00,
2019,12,"OO","SkyWest Airlines Inc.","GEG","Spokane, WA: Spokane International",264.00,40.00,10.56,2.70,2.60,0.67,23.48,3.00,1.00,2795.00,1002.00,216.00,74.00,18.00,1485.00,
2019,12,"OO","SkyWest Airlines Inc.","GFK","Grand Forks, ND: Grand Forks International",174.00,35.00,7.02,4.17,9.57,0.00,14.24,5.00,0.00,3836.00,452.00,1873.00,424.00,0.00,1087.00,
2019,12,"OO","SkyWest Airlines Inc.","GJT","Grand Junction, CO: Grand Junction Regional",263.00,52.00,18.96,3.86,11.45,0.00,17.73,1.00,0.00,3879.00,1174.00,919.00,502.00,0.00,1284.00,
2019,12,"OO","SkyWest Airlines Inc.","GNV","Gainesville, FL: Gainesville Regional",33.00,9.00,3.38,0.00,0.98,0.00,4.65,0.00,0.00,648.00,137.00,0.00,52.00,0.00,459.00,
2019,12,"OO","SkyWest Airlines Inc.","GRB","Green Bay, WI: Green Bay Austin Straubel International",146.00,35.00,10.78,2.98,11.90,0.00,9.34,2.00,0.00,3371.00,1735.00,560.00,492.00,0.00,584.00,
2019,12,"OO","SkyWest Airlines Inc.","GRK","Killeen, TX: Robert Gray AAF",2.00,0.00,0.00,0.00,0.00,0.00,0.00,0.00,0.00,0.00,0.00,0.00,0.00,0.00,0.00,
2019,12,"OO","SkyWest Airlines Inc.","GRR","Grand Rapids, MI: Gerald R. Ford International",259.00,57.00,23.29,5.29,13.49,0.00,14.93,3.00,0.00,3431.00,1621.00,265.00,567.00,0.00,978.00,
2019,12,"OO","SkyWest Airlines Inc.","GSO","Greensboro/High Point, NC: Piedmont Triad International",2.00,1.00,0.45,0.00,0.11,0.00,0.45,0.00,0.00,179.00,80.00,0.00,19.00,0.00,80.00,
2019,12,"OO","SkyWest Airlines Inc.","GSP","Greer, SC: Greenville-Spartanburg International",54.00,12.00,3.24,0.38,4.45,0.00,3.93,0.00,0.00,574.00,179.00,15.00,104.00,0.00,276.00,
2019,12,"OO","SkyWest Airlines Inc.","GTF","Great Falls, MT: Great Falls International",146.00,15.00,8.12,0.02,3.08,0.00,3.78,0.00,1.00,1596.00,1132.00,3.00,162.00,0.00,299.00,
2019,12,"OO","SkyWest Airlines Inc.","GTR","Columbus, MS: Golden Triangle Regional",107.00,15.00,5.16,1.00,0.40,0.00,8.43,0.00,1.00,1368.00,605.00,19.00,33.00,0.00,711.00,
2019,12,"OO","SkyWest Airlines Inc.","HDN","Hayden, CO: Yampa Valley",53.00,10.00,6.27,0.00,2.15,0.00,1.58,0.00,1.00,570.00,453.00,0.00,61.00,0.00,56.00,
2019,12,"OO","SkyWest Airlines Inc.","HIB","Hibbing, MN: Range Regional",54.00,5.00,1.34,0.00,3.02,0.00,0.64,1.00,0.00,370.00,133.00,0.00,164.00,0.00,73.00,
2019,12,"OO","SkyWest Airlines Inc.","HLN","Helena, MT: Helena Regional",115.00,11.00,4.38,1.89,0.07,0.00,4.66,0.00,1.00,1049.00,511.00,98.00,10.00,0.00,430.00,
2019,12,"OO","SkyWest Airlines Inc.","HOB","Hobbs, NM: Lea County Regional",86.00,23.00,7.37,1.00,3.15,0.00,11.48,0.00,0.00,2915.00,1512.00,27.00,125.00,0.00,1251.00,
2019,12,"OO","SkyWest Airlines Inc.","HOU","Houston, TX: William P Hobby",5.00,0.00,0.00,0.00,0.00,0.00,0.00,0.00,0.00,0.00,0.00,0.00,0.00,0.00,0.00,
2019,12,"OO","SkyWest Airlines Inc.","HPN","White Plains, NY: Westchester County",170.00,34.00,11.44,1.87,9.63,0.00,11.06,3.00,2.00,1741.00,565.00,87.00,418.00,0.00,671.00,
2019,12,"OO","SkyWest Airlines Inc.","HSV","Huntsville, AL: Huntsville International-Carl T Jones Field",84.00,17.00,11.54,0.00,1.33,0.71,3.42,1.00,0.00,1726.00,1103.00,0.00,46.00,12.00,565.00,
2019,12,"OO","SkyWest Airlines Inc.","HYS","Hays, KS: Hays Regional",108.00,12.00,2.19,0.00,3.26,0.00,6.56,2.00,2.00,1130.00,346.00,0.00,252.00,0.00,532.00,
2019,12,"OO","SkyWest Airlines Inc.","IAD","Washington, DC: Washington Dulles International",392.00,69.00,20.05,3.83,11.23,0.13,33.76,14.00,4.00,6643.00,2612.00,382.00,508.00,4.00,3137.00,
2019,12,"OO","SkyWest Airlines Inc.","IAH","Houston, TX: George Bush Intercontinental/Houston",1324.00,262.00,64.53,8.92,73.02,0.00,115.53,20.00,3.00,23616.00,7793.00,1679.00,2836.00,0.00,11308.00,
2019,12,"OO","SkyWest Airlines Inc.","ICT","Wichita, KS: Wichita Dwight D Eisenhower National",177.00,40.00,16.11,0.01,13.49,0.16,10.23,2.00,0.00,3598.00,2164.00,1.00,468.00,7.00,958.00,
2019,12,"OO","SkyWest Airlines Inc.","IDA","Idaho Falls, ID: Idaho Falls Regional",129.00,22.00,10.43,2.42,1.81,0.00,7.34,1.00,0.00,1160.00,622.00,69.00,82.00,0.00,387.00,
2019,12,"OO","SkyWest Airlines Inc.","ILM","Wilmington, NC: Wilmington International",97.00,15.00,6.90,0.85,2.40,0.00,4.85,0.00,0.00,1322.00,982.00,39.00,146.00,0.00,155.00,
2019,12,"OO","SkyWest Airlines Inc.","IMT","Iron Mountain/Kingsfd, MI: Ford",58.00,8.00,3.99,0.63,0.20,0.00,3.18,6.00,4.00,1096.00,942.00,22.00,9.00,0.00,123.00,
2019,12,"OO","SkyWest Airlines Inc.","IND","Indianapolis, IN: Indianapolis International",203.00,50.00,15.48,1.24,16.74,0.00,16.55,1.00,0.00,2513.00,876.00,59.00,640.00,0.00,938.00,
2019,12,"OO","SkyWest Airlines Inc.","INL","International Falls, MN: Falls International Einarson Field",52.00,6.00,0.16,0.00,1.84,0.00,4.00,3.00,0.00,321.00,5.00,0.00,96.00,0.00,220.00,
2019,12,"OO","SkyWest Airlines Inc.","ITH","Ithaca/Cortland, NY: Ithaca Tompkins Regional",84.00,19.00,6.60,3.11,0.51,0.00,8.78,2.00,0.00,2401.00,634.00,510.00,30.00,0.00,1227.00,
2019,12,"OO","SkyWest Airlines Inc.","JAC","Jackson, WY: Jackson Hole",128.00,25.00,9.17,0.03,7.60,0.00,8.20,0.00,2.00,2638.00,381.00,6.00,285.00,0.00,1966.00,
2019,12,"OO","SkyWest Airlines Inc.","JAN","Jackson/Vicksburg, MS: Jackson Medgar Wiley Evers International",60.00,19.00,8.18,0.82,4.27,0.00,5.73,1.00,0.00,1252.00,692.00,79.00,106.00,0.00,375.00,
2019,12,"OO","SkyWest Airlines Inc.","JAX","Jacksonville, FL: Jacksonville International",10.00,2.00,1.00,0.00,1.00,0.00,0.00,0.00,0.00,111.00,96.00,0.00,15.00,0.00,0.00,
2019,12,"OO","SkyWest Airlines Inc.","JFK","New York, NY: John F. Kennedy International",58.00,21.00,7.41,1.55,4.57,0.00,7.47,4.00,1.00,2532.00,982.00,775.00,317.00,0.00,458.00,
2019,12,"OO","SkyWest Airlines Inc.","JMS","Jamestown, ND: Jamestown Regional",84.00,15.00,4.01,2.99,4.50,0.00,3.49,4.00,1.00,2837.00,1263.00,950.00,164.00,0.00,460.00,
2019,12,"OO","SkyWest Airlines Inc.","LAN","Lansing, MI: Capital Region International",55.00,11.00,3.77,1.00,1.07,0.00,5.16,1.00,0.00,1583.00,1046.00,137.00,32.00,0.00,368.00,
2019,12,"OO","SkyWest Airlines Inc.","LAR","Laramie, WY: Laramie Regional",53.00,4.00,2.01,0.00,0.00,0.00,1.99,5.00,0.00,159.00,69.00,0.00,0.00,0.00,90.00,
2019,12,"OO","SkyWest Airlines Inc.","LAS","Las Vegas, NV: McCarran International",254.00,50.00,11.07,4.01,7.72,0.00,27.20,3.00,0.00,4901.00,1498.00,352.00,276.00,0.00,2775.00,
2019,12,"OO","SkyWest Airlines Inc.","LAW","Lawton/Fort Sill, OK: Lawton-Fort Sill Regional",59.00,7.00,1.00,2.74,0.84,0.00,2.42,3.00,1.00,554.00,123.00,311.00,41.00,0.00,79.00,
2019,12,"OO","SkyWest Airlines Inc.","LAX","Los Angeles, CA: Los Angeles International",3053.00,606.00,129.63,15.12,189.96,0.70,270.58,64.00,1.00,56079.00,23524.00,1958.00,7372.00,34.00,23191.00,
2019,12,"OO","SkyWest Airlines Inc.","LBB","Lubbock, TX: Lubbock Preston Smith International",68.00,5.00,1.70,0.00,1.48,0.00,1.82,2.00,0.00,449.00,167.00,0.00,72.00,0.00,210.00,
2019,12,"OO","SkyWest Airlines Inc.","LBF","North Platte, NE: North Platte Regional Airport Lee Bird Field",53.00,9.00,6.16,0.00,0.62,0.00,2.22,1.00,0.00,1381.00,1128.00,0.00,38.00,0.00,215.00,
2019,12,"OO","SkyWest Airlines Inc.","LBL","Liberal, KS: Liberal Mid-America Regional",54.00,4.00,2.00,0.00,0.36,0.00,1.64,1.00,1.00,327.00,152.00,0.00,41.00,0.00,134.00,
2019,12,"OO","SkyWest Airlines Inc.","LEX","Lexington, KY: Blue Grass",102.00,18.00,4.38,3.08,0.92,0.00,9.63,0.00,0.00,2074.00,793.00,292.00,56.00,0.00,933.00,
2019,12,"OO","SkyWest Airlines Inc.","LFT","Lafayette, LA: Lafayette Regional Paul Fournet Field",12.00,5.00,1.01,0.00,0.08,0.00,3.91,0.00,0.00,336.00,79.00,0.00,3.00,0.00,254.00,
2019,12,"OO","SkyWest Airlines Inc.","LGA","New York, NY: LaGuardia",316.00,93.00,9.97,9.41,42.87,0.61,30.13,6.00,0.00,8679.00,1412.00,939.00,3043.00,11.00,3274.00,
2019,12,"OO","SkyWest Airlines Inc.","LGB","Long Beach, CA: Long Beach Airport",208.00,25.00,8.52,2.62,5.08,0.63,8.14,2.00,0.00,1998.00,454.00,660.00,334.00,17.00,533.00,
2019,12,"OO","SkyWest Airlines Inc.","LIT","Little Rock, AR: Bill and Hillary Clinton Nat Adams Field",117.00,26.00,8.37,0.76,5.49,0.00,11.38,2.00,0.00,1875.00,658.00,20.00,176.00,0.00,1021.00,
2019,12,"OO","SkyWest Airlines Inc.","LNK","Lincoln, NE: Lincoln Airport",142.00,31.00,9.12,0.77,8.25,0.00,12.86,1.00,0.00,2344.00,498.00,200.00,335.00,0.00,1311.00,
2019,12,"OO","SkyWest Airlines Inc.","LRD","Laredo, TX: Laredo International",52.00,5.00,1.69,0.00,0.64,0.00,2.67,0.00,0.00,832.00,745.00,0.00,20.00,0.00,67.00,
2019,12,"OO","SkyWest Airlines Inc.","LSE","La Crosse, WI: La Crosse Regional",127.00,22.00,7.11,1.68,4.25,0.00,8.95,1.00,0.00,2233.00,444.00,899.00,117.00,0.00,773.00,
2019,12,"OO","SkyWest Airlines Inc.","LWB","Lewisburg, WV: Greenbrier Valley",53.00,13.00,7.48,2.00,0.92,0.00,2.60,4.00,0.00,851.00,518.00,178.00,48.00,0.00,107.00,
2019,12,"OO","SkyWest Airlines Inc.","LWS","Lewiston, ID: Lewiston Nez Perce County",91.00,10.00,5.67,1.00,0.57,0.00,2.76,0.00,4.00,488.00,373.00,16.00,16.00,0.00,83.00,
2019,12,"OO","SkyWest Airlines Inc.","MAF","Midland/Odessa, TX: Midland International Air and Space Port",68.00,12.00,5.26,0.00,2.75,0.00,3.99,1.00,0.00,1159.00,388.00,0.00,91.00,0.00,680.00,
2019,12,"OO","SkyWest Airlines Inc.","MBS","Saginaw/Bay City/Midland, MI: MBS International",159.00,40.00,22.20,3.11,11.11,0.00,3.57,4.00,0.00,3369.00,2099.00,647.00,326.00,0.00,297.00,
2019,12,"OO","SkyWest Airlines Inc.","MCI","Kansas City, MO: Kansas City International",264.00,53.00,20.26,3.09,7.82,0.00,21.83,6.00,0.00,3382.00,1381.00,227.00,296.00,0.00,1478.00,
2019,12,"OO","SkyWest Airlines Inc.","MDT","Harrisburg, PA: Harrisburg International",75.00,25.00,7.56,1.97,7.64,0.00,7.83,0.00,0.00,1720.00,368.00,163.00,314.00,0.00,875.00,
2019,12,"OO","SkyWest Airlines Inc.","MDW","Chicago, IL: Chicago Midway International",277.00,56.00,18.83,4.13,14.48,0.00,18.55,0.00,1.00,4039.00,1456.00,585.00,578.00,0.00,1420.00,
2019,12,"OO","SkyWest Airlines Inc.","MEI","Meridian, MS: Key Field",62.00,18.00,8.54,1.00,1.39,0.00,7.07,0.00,3.00,3384.00,2461.00,60.00,127.00,0.00,736.00,
2019,12,"OO","SkyWest Airlines Inc.","MEM","Memphis, TN: Memphis International",139.00,31.00,10.64,0.57,5.75,0.00,14.04,2.00,0.00,2365.00,799.00,61.00,277.00,0.00,1228.00,
2019,12,"OO","SkyWest Airlines Inc.","MFE","Mission/McAllen/Edinburg, TX: McAllen Miller International",15.00,5.00,0.09,0.00,0.21,0.00,4.70,0.00,0.00,634.00,10.00,0.00,22.00,0.00,602.00,
2019,12,"OO","SkyWest Airlines Inc.","MFR","Medford, OR: Rogue Valley International - Medford",388.00,69.00,24.38,4.63,8.07,0.00,31.92,9.00,1.00,5901.00,1582.00,1036.00,273.00,0.00,3010.00,
2019,12,"OO","SkyWest Airlines Inc.","MGM","Montgomery, AL: Montgomery Regional",220.00,31.00,9.01,3.43,2.61,0.00,15.95,0.00,1.00,2356.00,349.00,582.00,69.00,0.00,1356.00,
2019,12,"OO","SkyWest Airlines Inc.","MHK","Manhattan/Ft. Riley, KS: Manhattan Regional",53.00,5.00,0.97,1.00,0.27,0.00,2.76,1.00,0.00,308.00,106.00,52.00,22.00,0.00,128.00,
2019,12,"OO","SkyWest Airlines Inc.","MHT","Manchester, NH: Manchester-Boston Regional",47.00,11.00,3.95,0.00,5.05,0.00,2.00,1.00,1.00,535.00,370.00,0.00,131.00,0.00,34.00,
2019,12,"OO","SkyWest Airlines Inc.","MKE","Milwaukee, WI: General Mitchell International",426.00,90.00,28.53,3.10,18.71,0.00,39.66,7.00,0.00,9024.00,2256.00,1039.00,1984.00,0.00,3745.00,
2019,12,"OO","SkyWest Airlines Inc.","MKG","Muskegon, MI: Muskegon County",61.00,19.00,4.37,0.00,4.60,0.00,10.03,1.00,0.00,1483.00,755.00,0.00,121.00,0.00,607.00,
2019,12,"OO","SkyWest Airlines Inc.","MLB","Melbourne, FL: Melbourne International",,,,,,,,,,,,,,,,
2019,12,"OO","SkyWest Airlines Inc.","MLI","Moline, IL: Quad City International",123.00,25.00,6.96,0.73,2.59,0.00,14.72,0.00,0.00,1573.00,573.00,90.00,109.00,0.00,801.00,
2019,12,"OO","SkyWest Airlines Inc.","MLU","Monroe, LA: Monroe Regional",125.00,17.00,4.98,1.35,3.62,0.00,7.05,0.00,2.00,2353.00,1463.00,172.00,179.00,0.00,539.00,
