2019,12,"9E","Endeavor Air Inc.","GNV","Gainesville, FL: Gainesville Regional",172.00,17.00,4.49,1.38,5.23,0.00,5.89,0.00,1.00,1018.00,196.00,84.00,247.00,0.00,491.00,
2019,12,"9E","Endeavor Air Inc.","GPT","Gulfport/Biloxi, MS: Gulfport-Biloxi International",91.00,16.00,5.68,4.13,2.18,0.00,4.01,0.00,1.00,639.00,181.00,263.00,51.00,0.00,144.00,
2019,12,"9E","Endeavor Air Inc.","GRB","Green Bay, WI: Green Bay Austin Straubel International",131.00,18.00,6.86,0.05,6.97,0.00,4.13,4.00,1.00,1531.00,986.00,2.00,272.00,0.00,271.00,
2019,12,"9E","Endeavor Air Inc.","GRR","Grand Rapids, MI: Gerald R. Ford International",143.00,26.00,5.79,0.00,6.15,0.00,14.06,1.00,2.00,1301.00,309.00,0.00,276.00,0.00,716.00,
2019,12,"9E","Endeavor Air Inc.","GSO","Greensboro/High Point, NC: Piedmont Triad International",231.00,44.00,19.79,0.38,7.70,0.00,16.12,0.00,1.00,3725.00,1220.00,10.00,788.00,0.00,1707.00,
2019,12,"9E","Endeavor Air Inc.","GSP","Greer, SC: Greenville-Spartanburg International",104.00,24.00,5.61,0.96,4.12,0.00,13.31,1.00,0.00,1640.00,270.00,23.00,280.00,0.00,1067.00,
2019,12,"9E","Endeavor Air Inc.","HPN","White Plains, NY: Westchester County",87.00,10.00,4.24,0.77,3.24,0.00,1.75,1.00,0.00,451.00,276.00,17.00,66.00,0.00,92.00,
2019,12,"9E","Endeavor Air Inc.","HRL","Harlingen/San Benito, TX: Valley International",11.00,1.00,1.00,0.00,0.00,0.00,0.00,0.00,0.00,53.00,53.00,0.00,0.00,0.00,0.00,
2019,12,"9E","Endeavor Air Inc.","HSV","Huntsville, AL: Huntsville International-Carl T Jones Field",52.00,9.00,5.41,0.60,0.24,0.00,2.76,0.00,0.00,547.00,308.00,20.00,27.00,0.00,192.00,
2019,12,"9E","Endeavor Air Inc.","IAD","Washington, DC: Washington Dulles International",113.00,25.00,5.57,2.40,10.45,0.00,6.57,2.00,0.00,2054.00,325.00,479.00,630.00,0.00,620.00,
2019,12,"9E","Endeavor Air Inc.","IAH","Houston, TX: George Bush Intercontinental/Houston",77.00,18.00,5.40,3.54,4.70,0.00,4.35,0.00,0.00,1295.00,372.00,300.00,157.00,0.00,466.00,
2019,12,"9E","Endeavor Air Inc.","ILM","Wilmington, NC: Wilmington International",9.00,0.00,0.00,0.00,0.00,0.00,0.00,0.00,0.00,0.00,0.00,0.00,0.00,0.00,0.00,
2019,12,"9E","Endeavor Air Inc.","IND","Indianapolis, IN: Indianapolis International",197.00,34.00,7.85,2.17,12.63,0.00,11.35,1.00,0.00,1907.00,508.00,94.00,437.00,0.00,868.00,
2019,12,"9E","Endeavor Air Inc.","JAN","Jackson/Vicksburg, MS: Jackson Medgar Wiley Evers International",57.00,13.00,6.05,0.92,0.78,0.00,5.25,0.00,1.00,501.00,225.00,26.00,17.00,0.00,233.00,
2019,12,"9E","Endeavor Air Inc.","JAX","Jacksonville, FL: Jacksonville International",100.00,24.00,5.88,0.14,6.64,0.00,11.33,3.00,0.00,2032.00,591.00,31.00,397.00,0.00,1013.00,
2019,12,"9E","Endeavor Air Inc.","JFK","New York, NY: John F. Kennedy International",1606.00,334.00,65.99,8.10,138.85,0.00,121.05,26.00,1.00,26012.00,6000.00,979.00,9091.00,0.00,9942.00,
2019,12,"9E","Endeavor Air Inc.","LAN","Lansing, MI: Capital Region International",125.00,8.00,2.39,0.00,2.78,0.00,2.82,0.00,0.00,913.00,624.00,0.00,118.00,0.00,171.00,
2019,12,"9E","Endeavor Air Inc.","LEX","Lexington, KY: Blue Grass",181.00,28.00,15.44,0.38,2.48,0.00,9.71,1.00,1.00,1500.00,608.00,18.00,116.00,0.00,758.00,
2019,12,"9E","Endeavor Air Inc.","LFT","Lafayette, LA: Lafayette Regional Paul Fournet Field",98.00,6.00,2.52,0.00,0.00,0.00,3.48,0.00,0.00,196.00,72.00,0.00,0.00,0.00,124.00,
2019,12,"9E","Endeavor Air Inc.","LGA","New York, NY: LaGuardia",2335.00,631.00,77.90,15.83,322.91,0.00,214.36,61.00,12.00,57255.00,11997.00,1602.00,24795.00,0.00,18861.00,
2019,12,"9E","Endeavor Air Inc.","LIT","Little Rock, AR: Bill and Hillary Clinton Nat Adams Field",31.00,3.00,1.00,1.38,0.00,0.00,0.63,0.00,0.00,101.00,19.00,62.00,0.00,0.00,20.00,
2019,12,"9E","Endeavor Air Inc.","LNK","Lincoln, NE: Lincoln Airport",26.00,2.00,0.31,0.00,1.00,0.00,0.69,0.00,0.00,33.00,5.00,0.00,17.00,0.00,11.00,
2019,12,"9E","Endeavor Air Inc.","MBS","Saginaw/Bay City/Midland, MI: MBS International",63.00,7.00,0.91,1.63,1.04,0.00,3.42,0.00,1.00,583.00,91.00,96.00,43.00,0.00,353.00,
2019,12,"9E","Endeavor Air Inc.","MCI","Kansas City, MO: Kansas City International",114.00,29.00,4.77,1.00,8.20,0.00,15.03,4.00,0.00,1584.00,300.00,20.00,347.00,0.00,917.00,
2019,12,"9E","Endeavor Air Inc.","MCO","Orlando, FL: Orlando International",20.00,0.00,0.00,0.00,0.00,0.00,0.00,0.00,0.00,0.00,0.00,0.00,0.00,0.00,0.00,
2019,12,"9E","Endeavor Air Inc.","MDT","Harrisburg, PA: Harrisburg International",50.00,5.00,1.34,0.00,1.31,0.00,2.35,0.00,0.00,167.00,61.00,0.00,33.00,0.00,73.00,
2019,12,"9E","Endeavor Air Inc.","MDW","Chicago, IL: Chicago Midway International",1.00,0.00,0.00,0.00,0.00,0.00,0.00,0.00,0.00,0.00,0.00,0.00,0.00,0.00,0.00,
2019,12,"9E","Endeavor Air Inc.","MEM","Memphis, TN: Memphis International",134.00,33.00,9.50,0.00,11.83,0.00,11.67,1.00,0.00,1808.00,647.00,0.00,435.00,0.00,726.00,
2019,12,"9E","Endeavor Air Inc.","MHT","Manchester, NH: Manchester-Boston Regional",24.00,6.00,0.00,0.00,1.76,0.00,4.24,2.00,0.00,583.00,0.00,0.00,156.00,0.00,427.00,
2019,12,"9E","Endeavor Air Inc.","MKE","Milwaukee, WI: General Mitchell International",111.00,24.00,8.02,0.00,7.68,0.00,8.31,4.00,0.00,1818.00,570.00,0.00,487.00,0.00,761.00,
2019,12,"9E","Endeavor Air Inc.","MLI","Moline, IL: Quad City International",88.00,10.00,6.70,0.00,1.24,0.00,2.06,0.00,0.00,625.00,417.00,0.00,50.00,0.00,158.00,
2019,12,"9E","Endeavor Air Inc.","MOB","Mobile, AL: Mobile Regional",76.00,8.00,1.33,2.33,2.13,0.00,2.22,0.00,1.00,897.00,140.00,482.00,74.00,0.00,201.00,
2019,12,"9E","Endeavor Air Inc.","MOT","Minot, ND: Minot International",19.00,1.00,0.00,0.00,0.00,0.00,1.00,0.00,0.00,19.00,0.00,0.00,0.00,0.00,19.00,
2019,12,"9E","Endeavor Air Inc.","MSN","Madison, WI: Dane County Regional-Truax Field",134.00,25.00,7.79,0.00,5.79,0.00,11.43,1.00,0.00,1138.00,282.00,0.00,144.00,0.00,712.00,
2019,12,"9E","Endeavor Air Inc.","MSP","Minneapolis, MN: Minneapolis-St Paul International",1181.00,142.00,31.46,5.35,27.36,0.00,77.83,5.00,2.00,12174.00,3249.00,2041.00,1110.00,0.00,5774.00,
2019,12,"9E","Endeavor Air Inc.","MSY","New Orleans, LA: Louis Armstrong New Orleans International",1.00,0.00,0.00,0.00,0.00,0.00,0.00,0.00,0.00,0.00,0.00,0.00,0.00,0.00,0.00,
2019,12,"9E","Endeavor Air Inc.","MYR","Myrtle Beach, SC: Myrtle Beach International",28.00,3.00,0.23,0.66,0.34,0.00,1.77,0.00,0.00,76.00,5.00,19.00,10.00,0.00,42.00,
2019,12,"9E","Endeavor Air Inc.","OAJ","Jacksonville/Camp Lejeune, NC: Albert J Ellis",113.00,14.00,4.05,1.31,1.20,0.00,7.43,0.00,0.00,794.00,237.00,45.00,50.00,0.00,462.00,
2019,12,"9E","Endeavor Air Inc.","OMA","Omaha, NE: Eppley Airfield",52.00,6.00,0.61,0.00,3.69,0.00,1.70,0.00,0.00,636.00,132.00,0.00,145.00,0.00,359.00,
2019,12,"9E","Endeavor Air Inc.","ORD","Chicago, IL: Chicago O'Hare International",167.00,30.00,9.04,1.31,10.35,0.00,9.30,0.00,0.00,1402.00,291.00,85.00,540.00,0.00,486.00,
2019,12,"9E","Endeavor Air Inc.","ORF","Norfolk, VA: Norfolk International",201.00,50.00,11.76,1.53,12.72,0.00,23.99,5.00,2.00,4645.00,1724.00,183.00,952.00,0.00,1786.00,
2019,12,"9E","Endeavor Air Inc.","PHF","Newport News/Williamsburg, VA: Newport News/Williamsburg International",68.00,2.00,0.00,0.00,0.00,0.00,2.00,0.00,1.00,98.00,0.00,0.00,0.00,0.00,98.00,
2019,12,"9E","Endeavor Air Inc.","PHL","Philadelphia, PA: Philadelphia International",135.00,40.00,7.83,0.00,20.95,0.00,11.22,1.00,0.00,3548.00,1473.00,0.00,1411.00,0.00,664.00,
2019,12,"9E","Endeavor Air Inc.","PIT","Pittsburgh, PA: Pittsburgh International",232.00,53.00,9.56,2.98,16.79,0.00,23.68,6.00,3.00,5339.00,905.00,558.00,1437.00,0.00,2439.00,
2019,12,"9E","Endeavor Air Inc.","PWM","Portland, ME: Portland International Jetport",131.00,36.00,8.59,2.08,10.34,0.00,14.99,2.00,0.00,2749.00,716.00,118.00,857.00,0.00,1058.00,
2019,12,"9E","Endeavor Air Inc.","RDU","Raleigh/Durham, NC: Raleigh-Durham International",692.00,135.00,27.92,4.03,35.16,0.00,67.90,11.00,0.00,9794.00,2155.00,365.00,1555.00,0.00,5719.00,
2019,12,"9E","Endeavor Air Inc.","RIC","Richmond, VA: Richmond International",266.00,52.00,10.56,0.05,14.51,0.00,26.89,2.00,1.00,3313.00,596.00,3.00,620.00,0.00,2094.00,
2019,12,"9E","Endeavor Air Inc.","ROA","Roanoke, VA: Roanoke Blacksburg Regional Woodrum Field",58.00,2.00,1.00,0.00,1.00,0.00,0.00,0.00,1.00,59.00,44.00,0.00,15.00,0.00,0.00,
2019,12,"9E","Endeavor Air Inc.","ROC","Rochester, NY: Greater Rochester International",165.00,41.00,8.55,1.49,11.04,0.00,19.92,1.00,0.00,3063.00,644.00,129.00,764.00,0.00,1526.00,
2019,12,"9E","Endeavor Air Inc.","RST","Rochester, MN: Rochester International",49.00,6.00,3.44,0.00,0.60,0.00,1.96,0.00,0.00,222.00,109.00,0.00,31.00,0.00,82.00,
2019,12,"9E","Endeavor Air Inc.","RSW","Fort Myers, FL: Southwest Florida International",11.00,4.00,0.12,0.00,1.05,0.00,2.83,0.00,0.00,228.00,3.00,0.00,37.00,0.00,188.00,
2019,12,"9E","Endeavor Air Inc.","SAV","Savannah, GA: Savannah/Hilton Head International",137.00,33.00,6.00,0.00,10.24,0.00,16.76,1.00,0.00,2052.00,480.00,0.00,475.00,0.00,1097.00,
2019,12,"9E","Endeavor Air Inc.","SDF","Louisville, KY: Louisville Muhammad Ali International",30.00,4.00,1.58,0.00,1.25,0.00,1.17,0.00,0.00,254.00,27.00,0.00,83.00,0.00,144.00,
2019,12,"9E","Endeavor Air Inc.","SGF","Springfield, MO: Springfield-Branson National",116.00,9.00,3.79,1.15,1.34,0.00,2.73,0.00,0.00,443.00,181.00,75.00,35.00,0.00,152.00,
2019,12,"9E","Endeavor Air Inc.","SHV","Shreveport, LA: Shreveport Regional",116.00,9.00,4.91,1.19,1.09,0.00,1.81,0.00,1.00,442.00,238.00,28.00,20.00,0.00,156.00,
2019,12,"9E","Endeavor Air Inc.","STL","St. Louis, MO: St Louis Lambert International",136.00,43.00,13.58,0.00,11.91,0.00,17.51,4.00,0.00,2615.00,711.00,0.00,581.00,0.00,1323.00,
2019,12,"9E","Endeavor Air Inc.","SYR","Syracuse, NY: Syracuse Hancock International",164.00,24.00,5.64,0.94,6.45,0.00,10.97,3.00,0.00,1774.00,228.00,95.00,562.00,0.00,889.00,
2019,12,"9E","Endeavor Air Inc.","TLH","Tallahassee, FL: Tallahassee International",75.00,8.00,3.30,0.07,1.98,0.00,2.66,0.00,0.00,527.00,301.00,5.00,68.00,0.00,153.00,
2019,12,"9E","Endeavor Air Inc.","TPA","Tampa, FL: Tampa International",57.00,8.00,3.45,0.00,2.18,0.00,2.37,0.00,0.00,295.00,101.00,0.00,58.00,0.00,136.00,
2019,12,"9E","Endeavor Air Inc.","TRI","Bristol/Johnson City/Kingsport, TN: Tri Cities",22.00,4.00,0.00,0.25,2.00,0.00,1.75,0.00,0.00,100.00,0.00,10.00,36.00,0.00,54.00,
2019,12,"9E","Endeavor Air Inc.","TUL","Tulsa, OK: Tulsa International",51.00,5.00,1.37,0.00,2.00,0.00,1.63,0.00,0.00,151.00,42.00,0.00,45.00,0.00,64.00,
2019,12,"9E","Endeavor Air Inc.","TVC","Traverse City, MI: Cherry Capital",22.00,1.00,0.13,0.00,0.00,0.00,0.87,0.00,0.00,91.00,12.00,0.00,0.00,0.00,79.00,
2019,12,"9E","Endeavor Air Inc.","TYS","Knoxville, TN: McGhee Tyson",397.00,52.00,20.73,0.00,12.66,1.00,17.61,2.00,2.00,2384.00,950.00,0.00,410.00,57.00,967.00,
2019,12,"9E","Endeavor Air Inc.","VPS","Valparaiso, FL: Eglin AFB Destin Fort Walton Beach",37.00,4.00,1.60,1.00,1.17,0.00,0.23,0.00,1.00,141.00,80.00,15.00,39.00,0.00,7.00,
2019,12,"9E","Endeavor Air Inc.","XNA","Fayetteville, AR: Northwest Arkansas Regional",179.00,20.00,8.21,0.00,7.02,0.00,4.77,1.00,2.00,840.00,398.00,0.00,245.00,0.00,197.00,
2019,12,"AA","American Airlines Inc.","ABQ","Albuquerque, NM: Albuquerque International Sunport",268.00,54.00,25.12,2.46,8.46,0.00,17.95,0.00,0.00,2030.00,819.00,92.00,243.00,0.00,876.00,
2019,12,"AA","American Airlines Inc.","ALB","Albany, NY: Albany International",86.00,9.00,4.63,0.00,2.89,0.00,1.48,1.00,0.00,412.00,200.00,0.00,78.00,0.00,134.00,
2019,12,"AA","American Airlines Inc.","AMA","Amarillo, TX: Rick Husband Amarillo International",28.00,7.00,3.99,0.00,0.58,0.00,2.43,0.00,0.00,307.00,193.00,0.00,11.00,0.00,103.00,
2019,12,"AA","American Airlines Inc.","ATL","Atlanta, GA: Hartsfield-Jackson Atlanta International",1040.00,166.00,63.63,3.38,31.99,0.00,67.00,1.00,2.00,9613.00,3959.00,245.00,1096.00,0.00,4313.00,
2019,12,"AA","American Airlines Inc.","AUS","Austin, TX: Austin - Bergstrom International",941.00,134.00,50.66,3.40,25.43,0.11,54.39,1.00,1.00,7926.00,3541.00,147.00,768.00,3.00,3467.00,
2019,12,"AA","American Airlines Inc.","BDL","Hartford, CT: Bradley International",407.00,82.00,21.38,2.75,24.70,0.48,32.69,0.00,4.00,4429.00,1572.00,163.00,973.00,21.00,1700.00,
2019,12,"AA","American Airlines Inc.","BHM","Birmingham, AL: Birmingham-Shuttlesworth International",14.00,3.00,0.99,0.00,0.41,0.00,1.60,0.00,0.00,216.00,47.00,0.00,16.00,0.00,153.00,
2019,12,"AA","American Airlines Inc.","BNA","Nashville, TN: Nashville International",692.00,119.00,54.80,0.84,25.44,0.00,37.92,0.00,1.00,6806.00,3339.00,36.00,768.00,0.00,2663.00,
2019,12,"AA","American Airlines Inc.","BOI","Boise, ID: Boise Air Terminal",59.00,8.00,5.63,0.00,0.49,0.00,1.88,0.00,0.00,263.00,205.00,0.00,17.00,0.00,41.00,
2019,12,"AA","American Airlines Inc.","BOS","Boston, MA: Logan International",1956.00,533.00,90.93,15.68,256.10,0.03,170.26,39.00,1.00,38284.00,6200.00,1654.00,16788.00,4.00,13638.00,
2019,12,"AA","American Airlines Inc.","BUF","Buffalo, NY: Buffalo Niagara International",84.00,9.00,4.15,0.00,1.27,0.00,3.57,0.00,0.00,305.00,116.00,0.00,40.00,0.00,149.00,
2019,12,"AA","American Airlines Inc.","BUR","Burbank, CA: Bob Hope",68.00,21.00,6.28,0.00,11.20,0.00,3.52,0.00,2.00,635.00,176.00,0.00,296.00,0.00,163.00,
2019,12,"AA","American Airlines Inc.","BWI","Baltimore, MD: Baltimore/Washington International Thurgood Marshall",444.00,84.00,26.37,2.47,25.11,0.23,29.82,0.00,0.00,3841.00,1023.00,96.00,636.00,27.00,2059.00,
2019,12,"AA","American Airlines Inc.","BZN","Bozeman, MT: Bozeman Yellowstone International",31.00,1.00,0.29,0.00,0.00,0.00,0.71,0.00,0.00,45.00,13.00,0.00,0.00,0.00,32.00,
2019,12,"AA","American Airlines Inc.","CAE","Columbia, SC: Columbia Metropolitan",31.00,8.00,6.74,0.00,0.00,0.00,1.26,0.00,0.00,479.00,428.00,0.00,0.00,0.00,51.00,
2019,12,"AA","American Airlines Inc.","CHS","Charleston, SC: Charleston AFB/International",149.00,24.00,10.52,0.16,5.84,0.00,7.49,0.00,0.00,1033.00,386.00,19.00,154.00,0.00,474.00,
2019,12,"AA","American Airlines Inc.","CLE","Cleveland, OH: Cleveland-Hopkins International",203.00,36.00,13.11,0.47,4.25,0.00,18.16,0.00,0.00,1709.00,681.00,37.00,130.00,0.00,861.00,
2019,12,"AA","American Airlines Inc.","CLT","Charlotte, NC: Charlotte Douglas International",8423.00,1187.00,351.63,31.74,355.92,2.93,444.78,16.00,4.00,82684.00,32486.00,3316.00,11113.00,89.00,35680.00,
2019,12,"AA","American Airlines Inc.","CMH","Columbus, OH: John Glenn Columbus International",252.00,51.00,17.95,0.92,9.01,0.00,23.12,0.00,0.00,2671.00,736.00,23.00,285.00,0.00,1627.00,
2019,12,"AA","American Airlines Inc.","COS","Colorado Springs, CO: City of Colorado Springs Municipal",130.00,21.00,8.73,0.31,3.80,0.00,8.16,0.00,0.00,1096.00,373.00,15.00,99.00,0.00,609.00,
2019,12,"AA","American Airlines Inc.","CVG","Cincinnati, OH: Cincinnati/Northern Kentucky International",71.00,11.00,4.10,0.00,2.25,0.00,4.65,0.00,1.00,352.00,163.00,0.00,59.00,0.00,130.00,
2019,12,"AA","American Airlines Inc.","DCA","Washington, DC: Ronald Reagan Washington National",2210.00,404.00,115.83,9.24,133.01,1.05,144.87,19.00,6.00,24715.00,8221.00,488.00,4812.00,61.00,11133.00,
2019,12,"AA","American Airlines Inc.","DEN","Denver, CO: Denver International",862.00,183.00,69.37,1.04,55.19,0.81,56.58,1.00,0.00,10876.00,4552.00,67.00,2289.00,63.00,3905.00,
2019,12,"AA","American Airlines Inc.","DFW","Dallas/Fort Worth, TX: Dallas/Fort Worth International",12549.00,2090.00,550.92,46.60,707.34,3.84,781.29,18.00,21.00,129297.00,44343.00,3697.00,24897.00,135.00,56225.00,
2019,12,"AA","American Airlines Inc.","DSM","Des Moines, IA: Des Moines International",146.00,24.00,8.71,0.00,5.52,0.00,9.77,0.00,0.00,1127.00,502.00,0.00,142.00,0.00,483.00,
2019,12,"AA","American Airlines Inc.","DTW","Detroit, MI: Detroit Metro Wayne County",412.00,54.00,20.29,0.60,13.67,0.00,19.43,0.00,0.00,3314.00,1250.00,48.00,349.00,0.00,1667.00,
2019,12,"AA","American Airlines Inc.","EGE","Eagle, CO: Eagle County Regional",135.00,29.00,10.24,0.29,12.96,0.00,5.51,2.00,4.00,2474.00,784.00,15.00,1079.00,0.00,596.00,
2019,12,"AA","American Airlines Inc.","ELP","El Paso, TX: El Paso International",157.00,40.00,16.94,1.66,7.21,0.00,14.19,0.00,0.00,1905.00,878.00,79.00,280.00,0.00,668.00,
2019,12,"AA","American Airlines Inc.","EWR","Newark, NJ: Newark Liberty International",685.00,252.00,51.75,3.75,151.30,0.05,45.15,1.00,1.00,18678.00,2824.00,173.00,11129.00,1.00,4551.00,
2019,12,"AA","American Airlines Inc.","EYW","Key West, FL: Key West International",13.00,3.00,0.18,0.00,1.35,0.00,1.47,0.00,0.00,116.00,13.00,0.00,44.00,0.00,59.00,
2019,12,"AA","American Airlines Inc.","FAR","Fargo, ND: Hector International",14.00,2.00,0.43,0.00,0.82,0.00,0.75,1.00,0.00,1038.00,434.00,0.00,14.00,0.00,590.00,
2019,12,"AA","American Airlines Inc.","FAT","Fresno, CA: Fresno Yosemite International",120.00,12.00,8.09,0.00,1.85,0.00,2.06,0.00,0.00,771.00,628.00,0.00,76.00,0.00,67.00,
2019,12,"AA","American Airlines Inc.","FLL","Fort Lauderdale, FL: Fort Lauderdale-Hollywood International",636.00,137.00,45.93,2.05,55.39,0.17,33.46,0.00,3.00,6168.00,1787.00,91.00,2151.00,7.00,2132.00,
2019,12,"AA","American Airlines Inc.","GEG","Spokane, WA: Spokane International",79.00,15.00,6.29,0.00,3.30,0.00,5.41,0.00,0.00,669.00,244.00,0.00,92.00,0.00,333.00,
2019,12,"AA","American Airlines Inc.","GRR","Grand Rapids, MI: Gerald R. Ford International",59.00,19.00,8.33,0.99,5.12,0.00,4.56,0.00,0.00,2119.00,654.00,757.00,204.00,0.00,504.00,
2019,12,"AA","American Airlines Inc.","GSO","Greensboro/High Point, NC: Piedmont Triad International",54.00,12.00,5.31,0.15,1.49,0.00,5.04,0.00,0.00,776.00,235.00,10.00,38.00,0.00,493.00,
2019,12,"AA","American Airlines Inc.","GSP","Greer, SC: Greenville-Spartanburg International",44.00,7.00,2.52,0.00,0.66,0.00,3.82,0.00,0.00,383.00,169.00,0.00,23.00,0.00,191.00,
2019,12,"AA","American Airlines Inc.","GUC","Gunnison, CO: Gunnison-Crested Butte Regional",28.00,3.00,0.31,0.33,1.35,0.00,1.00,0.00,0.00,124.00,5.00,8.00,27.00,0.00,84.00,
2019,12,"AA","American Airlines Inc.","HDN","Hayden, CO: Yampa Valley",28.00,9.00,1.33,0.00,4.92,0.00,2.75,0.00,0.00,503.00,69.00,0.00,171.00,0.00,263.00,
2019,12,"AA","American Airlines Inc.","HNL","Honolulu, HI: Daniel K Inouye International",279.00,75.00,39.73,0.00,26.03,0.00,9.24,0.00,1.00,5863.00,3982.00,0.00,871.00,0.00,1010.00,
2019,12,"AA","American Airlines Inc.","IAD","Washington, DC: Washington Dulles International",183.00,39.00,15.74,1.82,7.89,0.27,13.28,0.00,0.00,2099.00,605.00,96.00,197.00,4.00,1197.00,
2019,12,"AA","American Airlines Inc.","IAH","Houston, TX: George Bush Intercontinental/Houston",667.00,115.00,50.17,1.31,24.82,0.95,37.74,1.00,0.00,5308.00,2246.00,58.00,759.00,20.00,2225.00,
2019,12,"AA","American Airlines Inc.","ICT","Wichita, KS: Wichita Dwight D Eisenhower National",59.00,6.00,3.98,0.00,0.70,0.00,1.32,0.00,0.00,206.00,139.00,0.00,22.00,0.00,45.00,
2019,12,"AA","American Airlines Inc.","ILM","Wilmington, NC: Wilmington International",100.00,17.00,7.00,0.00,3.34,0.00,6.66,0.00,0.00,740.00,283.00,0.00,98.00,0.00,359.00,
2019,12,"AA","American Airlines Inc.","IND","Indianapolis, IN: Indianapolis International",345.00,55.00,15.70,0.00,14.42,0.15,24.73,0.00,0.00,2688.00,708.00,0.00,382.00,4.00,1594.00,
2019,12,"AA","American Airlines Inc.","JAC","Jackson, WY: Jackson Hole",47.00,8.00,5.06,0.00,1.08,0.00,1.86,0.00,2.00,338.00,180.00,0.00,25.00,0.00,133.00,
2019,12,"AA","American Airlines Inc.","JAX","Jacksonville, FL: Jacksonville International",356.00,65.00,30.32,0.56,11.68,0.00,22.44,0.00,0.00,4057.00,2010.00,24.00,404.00,0.00,1619.00,
2019,12,"AA","American Airlines Inc.","JFK","New York, NY: John F. Kennedy International",1262.00,235.00,73.44,0.99,94.29,0.94,65.33,4.00,1.00,14807.00,5833.00,34.00,4354.00,16.00,4570.00,
2019,12,"AA","American Airlines Inc.","KOA","Kona, HI: Ellison Onizuka Kona International at Keahole",79.00,15.00,6.16,0.00,6.48,0.00,2.36,0.00,0.00,581.00,232.00,0.00,151.00,0.00,198.00,
2019,12,"AA","American Airlines Inc.","LAS","Las Vegas, NV: McCarran International",1211.00,247.00,81.67,3.68,80.33,2.85,78.48,0.00,0.00,14108.00,4824.00,177.00,4155.00,148.00,4804.00,
2019,12,"AA","American Airlines Inc.","LAX","Los Angeles, CA: Los Angeles International",3872.00,891.00,243.40,15.52,396.43,2.49,233.16,6.00,8.00,54396.00,19349.00,1418.00,13328.00,167.00,20134.00,
2019,12,"AA","American Airlines Inc.","LBB","Lubbock, TX: Lubbock Preston Smith International",60.00,14.00,5.02,1.49,0.23,0.00,7.25,0.00,0.00,1508.00,327.00,579.00,15.00,0.00,587.00,
2019,12,"AA","American Airlines Inc.","LGA","New York, NY: LaGuardia",1953.00,507.00,83.29,8.79,250.56,0.00,164.36,23.00,11.00,33027.00,4608.00,579.00,14798.00,0.00,13042.00,
2019,12,"AA","American Airlines Inc.","LIH","Lihue, HI: Lihue Airport",107.00,33.00,12.15,0.00,10.13,0.00,10.72,0.00,0.00,1961.00,775.00,0.00,343.00,0.00,843.00,
2019,12,"AA","American Airlines Inc.","LIT","Little Rock, AR: Bill and Hillary Clinton Nat Adams Field",16.00,1.00,0.04,0.00,0.02,0.00,0.95,0.00,0.00,57.00,2.00,0.00,1.00,0.00,54.00,
2019,12,"AA","American Airlines Inc.","MAF","Midland/Odessa, TX: Midland International Air and Space Port",71.00,15.00,6.20,1.00,0.03,0.00,7.76,0.00,0.00,1028.00,423.00,38.00,4.00,0.00,563.00,
2019,12,"AA","American Airlines Inc.","MCI","Kansas City, MO: Kansas City International",348.00,68.00,37.97,0.39,6.70,0.00,22.95,0.00,0.00,3766.00,1772.00,22.00,259.00,0.00,1713.00,
2019,12,"AA","American Airlines Inc.","MCO","Orlando, FL: Orlando International",1593.00,282.00,105.19,3.36,87.76,0.81,84.88,0.00,2.00,14103.00,5858.00,175.00,2897.00,13.00,5160.00,
2019,12,"AA","American Airlines Inc.","MDT","Harrisburg, PA: Harrisburg International",53.00,8.00,2.63,0.00,0.92,0.00,4.45,0.00,0.00,403.00,137.00,0.00,28.00,0.00,238.00,
2019,12,"AA","American Airlines Inc.","MEM","Memphis, TN: Memphis International",383.00,69.00,32.38,0.53,10.82,0.00,25.26,0.00,0.00,3291.00,1418.00,34.00,360.00,0.00,1479.00,
2019,12,"AA","American Airlines Inc.","MFE","Mission/McAllen/Edinburg, TX: McAllen Miller International",91.00,19.00,7.44,0.17,3.35,0.00,8.04,0.00,0.00,1378.00,758.00,12.00,109.00,0.00,499.00,
2019,12,"AA","American Airlines Inc.","MIA","Miami, FL: Miami International",4479.00,780.00,274.24,19.06,228.13,6.18,252.38,2.00,11.00,50574.00,21065.00,947.00,7669.00,226.00,20667.00,
2019,12,"AA","American Airlines Inc.","MKE","Milwaukee, WI: General Mitchell International",124.00,21.00,7.12,1.00,2.59,0.00,10.28,0.00,0.00,1499.00,615.00,22.00,127.00,0.00,735.00,
2019,12,"AA","American Airlines Inc.","MSN","Madison, WI: Dane County Regional-Truax Field",17.00,4.00,1.00,0.00,1.26,0.00,1.74,0.00,0.00,108.00,19.00,0.00,24.00,0.00,65.00,
2019,12,"AA","American Airlines Inc.","MSP","Minneapolis, MN: Minneapolis-St Paul International",530.00,84.00,37.69,0.92,19.78,0.00,25.60,0.00,0.00,4901.00,2622.00,41.00,819.00,0.00,1419.00,
2019,12,"AA","American Airlines Inc.","MSY","New Orleans, LA: Louis Armstrong New Orleans International",562.00,102.00,34.11,3.12,20.74,0.80,43.23,1.00,3.00,7667.00,2241.00,554.00,675.00,21.00,4176.00,
2019,12,"AA","American Airlines Inc.","MTJ","Montrose/Delta, CO: Montrose Regional",30.00,4.00,0.56,0.00,1.39,0.00,2.05,0.00,0.00,220.00,23.00,0.00,38.00,0.00,159.00,
2019,12,"AA","American Airlines Inc.","MYR","Myrtle Beach, SC: Myrtle Beach International",47.00,5.00,3.15,0.00,0.20,0.00,1.65,0.00,0.00,145.00,112.00,0.00,3.00,0.00,30.00,
2019,12,"AA","American Airlines Inc.","OAK","Oakland, CA: Metropolitan Oakland International",86.00,12.00,4.24,0.00,2.05,0.00,5.72,0.00,0.00,391.00,135.00,0.00,56.00,0.00,200.00,
2019,12,"AA","American Airlines Inc.","OGG","Kahului, HI: Kahului Airport",198.00,43.00,18.59,0.00,14.14,0.00,10.27,0.00,0.00,2376.00,1313.00,0.00,449.00,0.00,614.00,
2019,12,"AA","American Airlines Inc.","OKC","Oklahoma City, OK: Will Rogers World",131.00,22.00,10.75,0.44,1.53,0.00,9.28,0.00,0.00,1016.00,519.00,14.00,39.00,0.00,444.00,
2019,12,"AA","American Airlines Inc.","OMA","Omaha, NE: Eppley Airfield",166.00,24.00,6.16,0.95,5.39,0.00,11.50,0.00,0.00,1812.00,758.00,15.00,156.00,0.00,883.00,
2019,12,"AA","American Airlines Inc.","ONT","Ontario, CA: Ontario International",312.00,63.00,28.80,1.58,9.64,0.00,22.98,1.00,0.00,3053.00,1379.00,60.00,258.00,0.00,1356.00,
2019,12,"AA","American Airlines Inc.","ORD","Chicago, IL: Chicago O'Hare International",5349.00,878.00,229.62,11.55,319.51,1.15,316.18,9.00,2.00,56518.00,21450.00,728.00,10911.00,26.00,23403.00,
2019,12,"AA","American Airlines Inc.","ORF","Norfolk, VA: Norfolk International",147.00,20.00,9.02,0.00,3.73,0.00,7.25,0.00,1.00,872.00,359.00,0.00,120.00,0.00,393.00,
2019,12,"AA","American Airlines Inc.","PBI","West Palm Beach/Palm Beach, FL: Palm Beach International",500.00,99.00,34.70,3.25,31.12,0.00,29.93,1.00,0.00,4305.00,1404.00,89.00,818.00,0.00,1994.00,
2019,12,"AA","American Airlines Inc.","PDX","Portland, OR: Portland International",276.00,54.00,21.38,1.12,11.23,1.74,18.53,0.00,0.00,3013.00,1718.00,19.00,363.00,38.00,875.00,
2019,12,"AA","American Airlines Inc.","PHL","Philadelphia, PA: Philadelphia International",3649.00,781.00,186.30,20.26,311.49,0.77,262.17,7.00,2.00,56668.00,18359.00,1677.00,15153.00,20.00,21459.00,
2019,12,"AA","American Airlines Inc.","PHX","Phoenix, AZ: Phoenix Sky Harbor International",5226.00,907.00,274.22,18.15,297.62,3.92,313.09,11.00,4.00,61822.00,27203.00,1430.00,9371.00,128.00,23690.00,
2019,12,"AA","American Airlines Inc.","PIT","Pittsburgh, PA: Pittsburgh International",539.00,91.00,36.79,2.02,20.33,0.00,31.86,2.00,0.00,4602.00,1458.00,503.00,563.00,0.00,2078.00,
2019,12,"AA","American Airlines Inc.","PNS","Pensacola, FL: Pensacola International",54.00,9.00,5.69,0.00,0.00,0.00,3.31,0.00,0.00,343.00,216.00,0.00,0.00,0.00,127.00,
2019,12,"AA","American Airlines Inc.","PSP","Palm Springs, CA: Palm Springs International",133.00,21.00,6.74,0.53,8.55,0.00,5.18,0.00,0.00,859.00,327.00,25.00,263.00,0.00,244.00,
